User Name,User Profile,User Avatar,User Location,Rating,Rating Text,Review Title,Review Text,Helpful Votes,Photos,Published Date,Disclaimer,Review_Text_english
Evaldo de Souza,https://www.tripadvisor.com/Profile/drEvaldo,https://media-cdn.tripadvisor.com/media/photo-o/1a/f6/e2/e6/default-avatar-2020-45.jpg,"Sao Lourenco, MG",5,Jan 2024 • Family,MY EXPERIENCE WITH BELOMINAS CHAUFFEUR SERVICES,"Our experience with BELOMINAS was excellent. They are very professional, punctual, loyal and treat their customers with great respect and professionalism. Whenever we go to the United States, we will hire their services. I'd like to give a special thanks to Lucas Derik, one of the drivers: thank you for everything. All of them are excellent, but this is the best.",0,"https://media-cdn.tripadvisor.com/media/photo-w/2b/4e/0a/b7/caption.jpg
https://media-cdn.tripadvisor.com/media/photo-w/2b/4e/0a/33/caption.jpg","Written January 27, 2024",This review is the subjective opinion of a Tripadvisor member and not of Tripadvisor LLC.,"Our Experience with Belominas was Excellent.They are very professional, punctual, Loyal and Treat their customers with great respect and professionalism.Whenever We Go to the United States, We Will Hire Their Services.I'D Like to Give A Special Thanks to Lucas Derik, One of The Drivers: Thank You for Everything.All of them are Excellent, But This is the best."
Iphone do A,https://www.tripadvisor.com/Profile/iphonedoa,https://media-cdn.tripadvisor.com/media/photo-o/1a/f6/f4/5d/default-avatar-2020-32.jpg,,5,,Simplesmente fantásticos!!,"Simplesmente excelente. Parabens!!! Continuem assim…. Surpreendendo. Pontualidade, educação e muitos atenciosos.",0,"https://media-cdn.tripadvisor.com/media/photo-m/1280/2b/37/5d/43/caption.jpg
https://media-cdn.tripadvisor.com/media/photo-w/2b/37/5d/42/caption.jpg
https://media-cdn.tripadvisor.com/media/photo-w/2b/37/5d/41/caption.jpg","Written January 14, 2024",This review is the subjective opinion of a Tripadvisor member and not of Tripadvisor LLC.,"Simplely excellent.Parabens !!!Continuem Assim….Surreprenending.Pontificity, educação and very attention."
Nancy I,https://www.tripadvisor.com/Profile/nancyi491,https://media-cdn.tripadvisor.com/media/photo-o/1a/f6/ef/32/default-avatar-2020-12.jpg,,5,Dec 2023 • Family,Highly recommend ,"They did our arrival and departure and everything was excellent both times. Highly recommend. I travel with my whole family, husband and 3 kids. ",0,,"Written January 2, 2024",This review is the subjective opinion of a Tripadvisor member and not of Tripadvisor LLC.,"They Did Our Arrival and Departure and Everything was Excellents Both Times.Highly recommends.I Travel with My Whole Family, Husband and 3 Kids."
Clarissa P,https://www.tripadvisor.com/Profile/clarissap2024,https://media-cdn.tripadvisor.com/media/photo-o/1a/f6/f2/11/default-avatar-2020-23.jpg,,5,Dec 2023 • Family,My trip with family,"O serviço foi excelente! Super profissional, atenciosos! Vale muito a pena! Motoristas capacitados.<br />Um valor super justo! Recomendo pra qualquer um que vá para NY. <br />Obrigado novamente pela atenção com a minha família! ",0,,"Written January 2, 2024",This review is the subjective opinion of a Tripadvisor member and not of Tripadvisor LLC.,"Or Serviço Foi Excellent!Super Profissional, Attention!It is worth a shame!Trained motorists. <br /> UM Super fair value!I recommend pra qualquer um that you are for ny.<br /> Obrigado Novia Pela Atenção com a minha familia!"
Lisa,https://www.tripadvisor.com/Profile/lisalA742US,https://media-cdn.tripadvisor.com/media/photo-m/1280/28/bc/eb/ce/caption.jpg,United States,5,,Amazing Service,"Friendly, professional and punctual service. We couldn’t have asked for more. Our driver Lucas was amazing and offered us a wonderful experience. We were very pleased and will book again when in New York. Highly recommended!",0,,"Written December 29, 2023",This review is the subjective opinion of a Tripadvisor member and not of Tripadvisor LLC.,"Friendly, Professional and Punctual Service.We Couldn’t Have Asked For More.Our Driver Lucas was Amazing and offered US to Wonderful Experience.We were Vray Pleased and Will Book Again When in New York.Highly recommended!"
Getaway63192629780,https://www.tripadvisor.com/Profile/Getaway63192629780,https://media-cdn.tripadvisor.com/media/photo-o/1a/f6/e7/99/default-avatar-2020-57.jpg,"Chapeco, SC",5,Dec 2023 • Family,Transfer  de qualidade ,Excelente trabalho  desde o início até  o final.<br />Motorista educado e atencioso. <br />Carro espaçoso pois estávamos com 9 malas..,0,,"Written December 27, 2023",This review is the subjective opinion of a Tripadvisor member and not of Tripadvisor LLC.,Excellent task from O Início Até or Final. <br /> Educated and careful motorist.<br /> Pois Spanish car we were 9 bad ..
Bruno G Martins,https://www.tripadvisor.com/Profile/188brunog,https://media-cdn.tripadvisor.com/media/photo-o/15/f7/f9/04/caption.jpg,"Rio de Janeiro, RJ",5,Jul 2023 • Couples,bom atendimento com preço justo,"Serviço impecável de transfer prestado pela Pamila e equipe. Carro com excelente espaço, muito novo e muito confortável. Além do transfer ela deu boas dicas da cidade, restaurantes e shows. Ela ainda consegui bons ingressos com preços atrativos para nós. ",0,,"Written December 19, 2023",This review is the subjective opinion of a Tripadvisor member and not of Tripadvisor LLC.,"Serviço Impecável of Transfer Borrowed Pela Pamila E Equipe.The excellent Spanish car, muito novo e mutito confortável.Além do Transfer Ela Deu Boas Dicas da Cidade, Restaurants and Shows.ELA AINDAI BONS BONSOS COM Preços Atrarativas For Nós."
412leo,https://www.tripadvisor.com/Profile/412leo,https://media-cdn.tripadvisor.com/media/photo-o/1a/f6/e4/ca/default-avatar-2020-51.jpg,,5,May 2023 • Family,Excelente Serviço,"Muito atenciosos e profissionais! Conhecem muito a cidade, te ajudam no que for precioso em toda sua estada!",0,,"Written December 19, 2023",This review is the subjective opinion of a Tripadvisor member and not of Tripadvisor LLC.,"Muito Atencios and Profissionais!Conhecem muito a cidade, you ajudam not that for beautiful is all sua!"
Tiago N,https://www.tripadvisor.com/Profile/342tiagon,https://media-cdn.tripadvisor.com/media/photo-o/1a/f6/ed/ce/default-avatar-2020-7.jpg,,5,,The best transfer ih New York,"Não poderia estar mais satisfeito com este serviço. Tudo foi incrível. Dos carros ao atendimento fui tudo uma otima surpresa. Os motoristas sao muito simpaticos e profissionais, os carros sao fantasticos, recentes e muito limpos e sobretudo são muito pontuais.<br />Tenho a certeza que irei voltar!<br />Parabéns",0,https://media-cdn.tripadvisor.com/media/photo-w/2b/01/1b/cb/caption.jpg,"Written December 13, 2023",This review is the subjective opinion of a Tripadvisor member and not of Tripadvisor LLC.,"It was not possible to be most satisfied with this service.Tudo Foi Incrível.Two cars attended was Uma otima Surpressa.OS MOTORISTAS SAO MUITO SYMPATHICS AND PROFISIONAIS, OS SAO CAROS FANTASTICOS, RECENT AND MUIT LIMPOS E OVERTUDURE São MUITO PONTUAIS."
Vivis_Ribeiro,https://www.tripadvisor.com/Profile/Vivis_Ribeiro,https://media-cdn.tripadvisor.com/media/photo-o/0f/64/8e/0c/viviane-r.jpg,"Rio de Janeiro, RJ",5,Dec 2023 • Friends,Uma forma sossegada de chegar a NY.,"O serviço do pessoal da Belominas é excelente!<br />A contratação é fácil e a comunicação ótima. A Lorena foi uma querida!<br />O pagamento também é facilitado e o preço justo, se comparado com outros serviços de transfer.<br />No dia da viagem, assim que eu pousei no aeroporto do NY, já tinha uma mensagem da motorista que já estava à minha espera. A comunicação foi fácil e a viagem com a Michelle foi ótima!<br />Para quem não quer se preocupar com o deslocamento até o hotel depois de uma viagem cansativa, eu super recomendo o investimento.",0,,"Written December 6, 2023",This review is the subjective opinion of a Tripadvisor member and not of Tripadvisor LLC.,"O Serviço do pessoal of belominas and excellent!To Lorena Foi Uma Dear! <br /> Or also payed and facilitated and just preço, compared to the transfer of transfer.Motorist that Já is à minha wait.A Communicação foi e a viagem com a Michelle Foi otima!"
Sônia Macieira,https://www.tripadvisor.com/Profile/609s_niam,https://media-cdn.tripadvisor.com/media/photo-o/1a/f6/e9/bb/default-avatar-2020-65.jpg,"Vitoria, ES",5,,Eu recomendo,"Serviço de primeira qualidade.<br />Pontualidade, veículos e motoristas impecáveis.<br />Com certeza voltarei a contratar.<br />Pode até ser mais caro que outros transferes mas vale a pena.",0,,"Written December 2, 2023",This review is the subjective opinion of a Tripadvisor member and not of Tripadvisor LLC.,"Serviço de Primeira Quadade. <br /> Pontificuality, Veicles and Motorists Impecáveis. <br /> Com Certainty voltarei to hire. <br /> I could be at MAIS expensive than transferes or sentence."
Alessandra A,https://www.tripadvisor.com/Profile/alessandraaB7485GG,https://media-cdn.tripadvisor.com/media/photo-o/1a/f6/ed/7b/default-avatar-2020-6.jpg,,5,Nov 2023 • Couples,Experiência Maravilhosa,"Nós adoramos o Transfer da Belominas, atendimento impecável, o nosso motorista Lucas um querido, nos dando varias dicas, sem contar o conforto do carro. Adoramos tudo. Com certeza em uma próxima oportunidade vamos contrata-los novamente. ",0,,"Written November 30, 2023",This review is the subjective opinion of a Tripadvisor member and not of Tripadvisor LLC.,"Nós we adore or transfer Belominas, attending impecável, or biker nosso lucas um dear, giving us several dicas, sem count or comfort do car.We worship tudo.Com Certainty em uma next opportunity we are wearing a wker."
Fatima P,https://www.tripadvisor.com/Profile/D1647ROfatimap,https://media-cdn.tripadvisor.com/media/photo-o/1a/f6/e6/ea/default-avatar-2020-54.jpg,,5,,Experiência em NYC!!,"Nossa primeira vez em NYC, e a experiência com a empresa do transfer não poderia ter sido melhor. 🗽<br />Mais uma vez gostaria de agradecer todo apoio, profissionalismo, carinho e preocupação que tiveram conosco durante toda a nossa estadia na cidade.<br />Vcs foram perfeitos… muito atenciosos, pontuais, educados, simpáticos e prestativos.<br /><br />Com certeza indicaremos aos amigos o serviço de vcs!!<br /><br />Sucesso e prosperidade!! 🥰",0,"https://media-cdn.tripadvisor.com/media/photo-w/2a/e7/ec/dc/caption.jpg
https://media-cdn.tripadvisor.com/media/photo-w/2a/e7/ec/db/caption.jpg
https://media-cdn.tripadvisor.com/media/photo-m/1280/2a/e7/ec/da/caption.jpg","Written November 28, 2023",This review is the subjective opinion of a Tripadvisor member and not of Tripadvisor LLC.,"Nossa Primeira time em nyc, and to experiment com a company do transfer não power it was Melhor.🗽 <br /> Mais uma once goser to thank all Apoio, Profissionaism, Carinho and worries that Tiveram Conosco throughout Nossia Na Cidade. <br /> Vcs Foram perfeitos ... muito Attention, pontuais, educated, sympathetic and provisions.Br /> <br /> Com Certainty We will indicate to friends or serviço de vcs !! <br /> <br /> Success and prosperity !!🥰"
Sheyla H,https://www.tripadvisor.com/Profile/622sheylah,https://media-cdn.tripadvisor.com/media/photo-s/05/a3/d1/91/sheyla-h.jpg,"Estrela, RS",5,,Translado VIP,"Motorista extremamente educado, simpático, inteligente, pontual e prestativo. Respondeu a todas às perguntas q nós fizemos durante o translado do aeroporto ao hotel e vice versa, inclusive demonstrando conhecimento histórico e atualizado sobre locais e eventos da cidade. Muito bem vestido e alinhado, superando todas às nossas expectativas.",0,,"Written November 28, 2023",This review is the subjective opinion of a Tripadvisor member and not of Tripadvisor LLC.,"Extremely educated, sympathetic, intelligent, pontual and provisions.Respond to all of us that we are who are for or translated from Airport Ao a Hotel E vice versa, including demonstrating historical and tunee confimentary on Locais e cidage events.Muito Bem dressed and alinhado, surpassing all of us with expectations."
rms S,https://www.tripadvisor.com/Profile/Storyteller212083,https://media-cdn.tripadvisor.com/media/photo-o/1a/f6/f2/7a/default-avatar-2020-25.jpg,,5,Nov 2023 • Couples,Transfer.,"Serviço impecável. Muito atenciosos. Pontuais. Altamente recomendável. Carros novos e limpos. Motoristas educados, com conhecimento da região. ",0,,"Written November 14, 2023",This review is the subjective opinion of a Tripadvisor member and not of Tripadvisor LLC.,"Impecável Serviço.Muito Attention.Pontuais.Highly recommends Vel.Novos and Limpos cars.Educated motorists, com Conhecimento da Região."
Dujutbm C,https://www.tripadvisor.com/Profile/dujutbmc,https://media-cdn.tripadvisor.com/media/photo-o/1a/f6/f2/11/default-avatar-2020-23.jpg,,5,Nov 2023 • Family,Confiança e respeito,"Ótimo atendimento! Pontualidade ,respeito e atenção ao cliente, motoristas atenciosos e menção especial ao Lucas Derick, pela simpatia e cordialidade desde o início do atendimento. ",0,,"Written November 14, 2023",This review is the subjective opinion of a Tripadvisor member and not of Tripadvisor LLC.,"OUTE ATENDIMENT!Pontificity, I respect and attenção ao client, Motorists Atencious and special menção lucas derick, pela sympathy and cordiality from or início do attending."
Cezário S,https://www.tripadvisor.com/Profile/cez_ri0s,https://media-cdn.tripadvisor.com/media/photo-o/1a/f6/e5/66/default-avatar-2020-53.jpg,,5,Sep 2023 • Family,Transfer perfeito!,"Excelente atendimento. Motoristas educados, com ótima interação! Tanto o César quanto a Pamila foram muito corteses. ",0,,"Written October 5, 2023",This review is the subjective opinion of a Tripadvisor member and not of Tripadvisor LLC.,"Excellent attending.Educated motorists, as interação otima!Both or César quanto to Pamila Foram Mitito courtes."
vanessa z,https://www.tripadvisor.com/Profile/368vanessaz,https://media-cdn.tripadvisor.com/media/photo-o/1a/f6/ea/74/default-avatar-2020-68.jpg,,5,Sep 2023 • Family,Transfer New york,"Everything were perfect. Lucas was very nice, pontual, car very clean. there was water for the for of us.  Igot this transfer on the arrival. I liked so much that I took also to the return. I recomend this company. ",0,,"Written October 4, 2023",This review is the subjective opinion of a Tripadvisor member and not of Tripadvisor LLC.,"EveryTHING WERE PERFECT.Lucas Was Vary Nice, Pontual, Car Vray Clean.There Water for the for of us.Igot This Transfer on the Arrival.I LIKED So much that I Took Also to The Return.I RECOMMENDS THIS COMPANY."
Aretha,https://www.tripadvisor.com/Profile/arethabrauner,https://media-cdn.tripadvisor.com/media/photo-o/1a/f6/e4/2d/default-avatar-2020-48.jpg,"Guarulhos, SP",5,Sep 2023 • Couples,Serviço sensacional ,"Fizemos o Transfer de ida e volta . Contratamos do Brasil e deu tudo super certo .os motoristas são pontuais, solícitos é muito muito simpático . Adoramos e quando voltarmos repetiremos a experiência. Muito obrigada ☺️ por tudo !",0,,"Written October 4, 2023",This review is the subjective opinion of a Tripadvisor member and not of Tripadvisor LLC.,"Let's Fizue or Transfer de Ida e Volta.We hired Brazil and Deu Tudo Super Certo. Motorists São Pontuais, Solícitos é Mitito Muito Sympathetic.We worship and when we voltar we will repeat experience.MUITO OBRIGADA ☺️ Tudo!"
Leide Daiane f,https://www.tripadvisor.com/Profile/leidedaianef2022,https://media-cdn.tripadvisor.com/media/photo-o/1a/f6/f3/7c/default-avatar-2020-29.jpg,,5,Sep 2023 • Family,"Excelente atendimento, ótimo trabalho super recomendo","A vista era maravilhosa, divertimos muito.  O atendimento excelente tiramos muitas fotos, o transporte foi super confortável e seguro.",0,,"Written September 25, 2023",This review is the subjective opinion of a Tripadvisor member and not of Tripadvisor LLC.,"In sight it was wonderful, we had fun.O Attended excellent we throw little photos, or transport foi super comfort and safe."
Vinicius C,https://www.tripadvisor.com/Profile/viniciuscE5988EB,https://media-cdn.tripadvisor.com/media/photo-o/1a/f6/e4/ca/default-avatar-2020-51.jpg,,5,Sep 2023 • Business,Excelente,"Recomendei o serviços para amigos. Recebi todo o suporte durante minha estadia em Nova York, transfer de qualidade e pontual. ",0,,"Written September 25, 2023",This review is the subjective opinion of a Tripadvisor member and not of Tripadvisor LLC.,"Recommended or Serviços for friends.I received everything or I supply during Minha Stadia Em Nova York, Transfer of Quad and Pontual."
Raquel F,https://www.tripadvisor.com/Profile/R8320EBraquelf,https://media-cdn.tripadvisor.com/media/photo-o/1a/f6/eb/6d/default-avatar-2020-19.jpg,,5,Aug 2023 • Family,"Adorei cada momento, obrigada pelo suporte Belominas","Agradeço cada momento especial e espetacular que puderam me proporcionar, agradeço dms a belominas foi a melhor escolha da minha vida ♥️",0,,"Written September 25, 2023",This review is the subjective opinion of a Tripadvisor member and not of Tripadvisor LLC.,"I like every special and specifically moment that could provide me, please DMS to Belominas Foi a Melhor Escolha da Minha Life ♥ ️"
Felipe B,https://www.tripadvisor.com/Profile/felipebG2477XQ,https://media-cdn.tripadvisor.com/media/photo-s/0f/56/55/ec/felipe-b.jpg,"Recife, PE",5,Aug 2023 • Couples,Ótimo serviço!,"Pontual, atenciosos e nos apoiaram bastante em alguns problemas que tivemos nos ajudando na resolução.",0,,"Written September 20, 2023",This review is the subjective opinion of a Tripadvisor member and not of Tripadvisor LLC.,"Pontual, ATTENCIOS EI SUBAIARAM PERIOD EM SOME PROBLEMS THAT WE TIVED ourselves na resolução."
Remy L,https://www.tripadvisor.com/Profile/941remyl,https://media-cdn.tripadvisor.com/media/photo-o/1a/f6/e3/6a/default-avatar-2020-47.jpg,,5,Aug 2023 • Family,tranquility and confidence,"Everything was very good. The service, the people, the cars, the timing, very friendly and trustworthy.<br />Me and my family had a very positive experience",0,,"Written September 19, 2023",This review is the subjective opinion of a Tripadvisor member and not of Tripadvisor LLC.,"Everything was see good.The Service, The People, The Cars, The Timing, Vary Friendly and Trustworthy."
Sydney M,https://www.tripadvisor.com/Profile/sydneymN7622UK,https://media-cdn.tripadvisor.com/media/photo-o/1a/f6/e5/2b/default-avatar-2020-52.jpg,,1,Dec 2023 • Friends,Unreliable & Charged my card over $1000!!!!,"Warning this company is no longer reliable. They DOUBLED the price of my ride the day of the event and CHARGED MY CARD OVER $1000 without my permission. I am currently working to get $390 back still.<br />I do not know if they changed management, but I experienced the most unprofessional car service booking of my life. I booked a sprinter van for 14 ppl for the night of NYE. After booking online I called to ensure the booking was accurate and received by all parties. The day of my booking, I received a notification that the price for my trip leaving had doubled!! Their reasoning was because the driver I had decided to raise his price due the holiday. I’m not sure what that has to do with me as a customer?? Dial 7 should have dealt with the driver internally rather than punishing a customer the day of their event! I actually ended up having to negotiate the driver down through the phone operator (yes this is crazy but I had no other choice at the time). <br /><br />After agreeing to pay the driver a higher rate, a few hours later, I see a charge on my card for $648!!! Like what! Keep in mind the total cost of my trip was about $880 so where does that number even come from?<br /><br />I called to complain 3 times. The first time, the operate said it was to check my funds and would be refunded within the hour. When it was not refunded, I called again and an extremely rude and uninformed man told me that the previous operator gave me the wrong information (???) and I would not receive my money back until after I paid for the first trip. I hung up out of frustration and called back later for more clarity. Upon calling a 3rd time, I notice that my account was charged again for $390. I nearly had a heart attack. I haven’t been that mad in a LONG time. <br /><br />I called again and threatened to call my bank and report fraud and I accused them of being scammers. The operate let me know the only way to refund me would be to cancel my trip. When I asked if she could rebook I heard the same rude male operators voice in the background demanding the woman on the phone to hang up on me and cancel my trip entirely without rebooking. <br /><br />Long story short, my trip was canceled. I received a refund a few hours later for the $648 and I’m still waiting on the $390. I called them today and will report fraud if it is not deposited within the next couple hours. <br /><br />Ultimately, it was a blessing they canceled because I definitely did not want to support them after all they went through. We were actually able to fit our group of 14 into two large Ubers which we scheduled a few hours earlier. The price stays the same if you schedule in advance. <br /><br />Do not ruin your plans trying to book with this company they are extremely rude and unprofessional and irresponsible with credit cards. I still can’t believe they charged my card like that. Feeling financially violated. I never leave reviews, but refuse to accept that. Good riddens, Dial 7 !!!",0,,"Written January 2, 2024",This review is the subjective opinion of a Tripadvisor member and not of Tripadvisor LLC.,"Warning This Company is no longable longer.They Doubled The Price of My Ride The Day of the Event and Charged My Card Over $ 1000 Without My Permision.I am Currently Working to get $ 390 Back Still.I Booked sprinter van for 14 ppl for the night of nye.After Booking Online I. Called To Reure The Booking was Accurate and Received by All Parties.The Day of My Booking, I prescribe a notification that the price for my triping haad dobled !!Their Reasoning was the Becouse The Driver I had to say to raise his price due the holiday.I’m not surre What that have to do with me a customer?Dial 7 Should Have Dealt With The Driver Internality Rather Than Punishing A Customer The Day of Event!I EDED UP HAVING TO NEGOTIATE THE DRIVER THROUCH THE PHONE OPERATOR (YES THIS IS CRAZY BUT I HAD NO OTHER CHOICE AT THE TIME).<br /> <br /> AFTER AGREEING TO PAY THE DRIVER TO HIGHER RATE, A FEW HOUGE LATER, I see A CHARGE ON MY CARD FOR $ 648 !!!Like What!Keep in Mind the Total Cost of My Trip Was About $ 880 So Where Does That Number Even Come From? <br /> <br /> I Called To Comlain 3 Times.The First Time, The Operate Said It was to check my Funds and Would Be refund with the hour.WHEN IT WAS NOT REFUENDED, I CALLED AGAIN AND AN EXTREMELY RUDE AND UNINFORMED MAN TOLED ME THAT THE PRISOUS OPERATOR GAVE ME THE WRONG INFORMATION (?I Hung Up out of frustration and street back late for more clarity.UPON CALLING A 3RD TIME, I NEWS THAT MY ACCOUNT WAS CHARGED AGAIN FOR $ 390.I Nearly had Heart Attack.I have’t Been that Mad in a Long Time.<br /> <br /> I Calleed Again and Threatened to Call My Bank and Report Fraud and I ACCseded Them of Being Scammers.The Operate Let Me Know The Only Way To Refund Me Would Be To Cancel My Trip.WHEN I ASKED IF SHE COUD REBOOK I HEARD THE SAME RUDE MALE OPERATORS VOICE IN THE BACKGUNDING THE WOMAN ON THE PHONE TO HANG UP ON ME AND CANCEL MY TRIP TRIP Entirely Without Rebooking.<br /> <br /> Long Story Short, My Trip Was Canceled.I receive refounds to Few Hours late for the $ 648 and i’m still waiting on the $ 390.I Calleed Them Today and Will Report Fraud If is not deposited with the Next Couple Hours.<br /> <br /> Ultimately, It was a blessing they canceled Because I definitely Did Not Want To Support Them After They Went Through.We were Ultimate To Fit Our Group of 14 into two Large Ubers which we scheduled A Few Hours Earlier.The Price Stays The Same If You Schedule In Advance.<br /> <br /> Do not ruin your plans trying to book with This Company they are extremely Rude and Un Professional and Irresponsible With Credit Cards.I Still Can’t Believe They Charged My Card Like That.Feeling Financially Violated.I Never Leave Reviews, But Refuse to Accept That.Good Riddens, dial 7 !!!"
