User Name,User Profile,User Avatar,User Location,Rating,Rating Text,Review Title,Review Text,Helpful Votes,Photos,Published Date,Disclaimer,Review_Text_english
charyamaz88,https://www.tripadvisor.com/Profile/charyamaz88,https://media-cdn.tripadvisor.com/media/photo-o/1a/f6/e8/ea/default-avatar-2020-63.jpg,,5,Jan 2024,Thank you!!,Charles was Awesome and upbeat! Had great conversations and thank you pointing out the different cities!  Mahalos Braddah. (Thank you. Bro) ,0,,"Written January 27, 2024",This review is the subjective opinion of a Tripadvisor member and not of Tripadvisor LLC.,Charles Was Awesome and Upbeat!Had Great Conversations and Thank You Pointing Out The Different Cities!Mahalos Braddah.(Thank You. Bro)
REVIEW1992,https://www.tripadvisor.com/Profile/REVIEW1992,https://media-cdn.tripadvisor.com/media/photo-o/1a/f6/de/0a/default-avatar-2020-35.jpg,"Hampshire, UK",5,Jan 2024 • Friends,Excellent Service,"We booked transfers from/to JFK using this company. As a group of 6 adults we found the vehicles to be clean, comfortable & spacious. The drivers were superb - Alfonso on the journey into Manhattan and Charles on the return. Both drivers were professional, friendly and super helpful. The reconfirmation message from the company at -24hrs was reassuring for our group and the 1:1 texts from the drivers on the day with pick up info made this a seamless transfer. Will definitely book for next trip.",0,,"Written January 19, 2024",This review is the subjective opinion of a Tripadvisor member and not of Tripadvisor LLC.,"We Booked Transfers from/to JFK Using This Company.As a Group of 6 Adults We Found The Vehicles to Be Clean, Comforable & Spacious.The Divers Were Superb - Alfonso On The Journey Into Manhattan and Charles On The Return.Both drivers were Professional, Friendly and Super Helpful.The Reconfirmion Message From The Company AT -24hrs was reassuring for Our Group and the 1: 1 texts from the drivers on the day with pick up info made this a Seamless Transfer.Will Definitely Book for Next Trip."
marianampires,https://www.tripadvisor.com/Profile/marianampires,https://media-cdn.tripadvisor.com/media/photo-o/1a/f6/ef/32/default-avatar-2020-12.jpg,"Lisbon, Portugal",5,Jan 2024,Transportation from the hotel to the airport,"We had a wonderful experience with NYC Perfect Transportation, the driver was nice, me and my friends loved is energy and was nice to meet someone so amicable. Besides the he was on time, the car was super clean and comfortable. The whole service was incredible.",0,,"Written January 17, 2024",This review is the subjective opinion of a Tripadvisor member and not of Tripadvisor LLC.,"We had a Wonderful Experience with nyc perfect transport, The Driver was Nice, Me and My Friends Loved is Energy and was nice to meet sumone is friendly.Besides The He was on time, The Car Was Super Clean and Comfortable.The Whole Service Was Incredible."
Adventure09963328947,https://www.tripadvisor.com/Profile/Adventure09963328947,https://media-cdn.tripadvisor.com/media/photo-o/1a/f6/ec/3d/default-avatar-2020-1.jpg,,5,Jan 2024 • Family,Perfect pick-up!,"Clean and comfortable car, polite driver, messaged us in advance to keep us updated, on-time, what more do you need?!",0,,"Written January 13, 2024",This review is the subjective opinion of a Tripadvisor member and not of Tripadvisor LLC.,"Clean and Comfortable Car, Polite Driver, Message Us In Advance To Keep Updated, On-Time, What More Do You Need?!"
Georgia S,https://www.tripadvisor.com/Profile/166georgias,https://media-cdn.tripadvisor.com/media/photo-o/1a/f6/e8/ea/default-avatar-2020-63.jpg,"Cleethorpes, UK",5,Dec 2023,Wouldn’t use anyone else!,"Perfect Transportation really do live up to their name, they are perfect! Wouldn’t book anyone else, reliable, professional, friendly, helpful and the cars are stunning. We booked SUV transport from airport and return, we was so happy with both cars and drivers! They may not be the cheapest but they are so worth it! ",0,,"Written January 12, 2024",This review is the subjective opinion of a Tripadvisor member and not of Tripadvisor LLC.,"Perfect Transportation Really do Live Up to their name, They are perfect!Wouldn’t Book Anyone Else, Reliable, Professional, Friendly, Helpful and the Cars Are Stunning.We Booked Suv Transport from Airport and Return, We was so happy with bck cars and drivers!They may not be the cheapst but they are so worth it!"
Tesha3005,https://www.tripadvisor.com/Profile/Tesha3005,https://media-cdn.tripadvisor.com/media/photo-o/1a/f6/eb/43/default-avatar-2020-11.jpg,"Birmingham, AL",5,Jan 2024,Airport pick up,The driver communicated with me very well! He met us a baggage claim in the La Guardia airport. He was and excellent driver and very professional. I will definitely use them again! ,0,,"Written January 11, 2024",This review is the subjective opinion of a Tripadvisor member and not of Tripadvisor LLC.,The Driver Communicated with Me Vary Well!I have met us a Baggage Claim in the La Guardia Airport.He was and Excellent Driver and Vary Professional.I Will Definitely Use Them Again!
Quest22309604050,https://www.tripadvisor.com/Profile/Quest22309604050,https://media-cdn.tripadvisor.com/media/photo-o/1a/f6/e2/11/default-avatar-2020-41.jpg,,5,Dec 2023 • Family,Excellent journey from JFK into Manhattan,"Our driver, Marwan, contacted us in good time to coordinate the pickup at the right time. He was very pleasant to talk to. The drive was smooth and the car very comfortable. It was the first time in New York for my children, so he took the more scenic Queensborough bridge instead of the Midtown tunnel. Such details make one smile. Overall, the service was excellent.  ",0,,"Written January 8, 2024",This review is the subjective opinion of a Tripadvisor member and not of Tripadvisor LLC.,"OUR DRIVER, MARWAN, CONTACTED US IN GOOD TIME TO COORDINATE THE PICKUP AT THE RIGHT TIME.He was see pleasant to talk to.The Drive Was Smooth and the Car Vray Comfortable.It was The First Time in New York for My Children, So He Took The More Scenic Queensborough Bridge Institute of the Midtown Tunnel.Such Details Make One Smile.Overall, The Service was Excellent."
TH1711,https://www.tripadvisor.com/Profile/TH1711,https://media-cdn.tripadvisor.com/media/photo-o/1a/f6/f1/b8/default-avatar-2020-22.jpg,,5,Dec 2023 • Family,NYC trip,"NYC Perfect Transportation was great to work with! They were very helpful at booking,  communication was great at time of pick up, and they were on time. I would recommend this company to anyone traveling to NYC. ",0,,"Written January 6, 2024",This review is the subjective opinion of a Tripadvisor member and not of Tripadvisor LLC.,"NYC Perfect Transportation was great to work with!They were Vray Helpful at Booking, Communication was great at time of pick up, and they were on time.I WOULD RECOMMEND THIS COMPANY TO ANYONE TRAVELING TO NYC."
Lachlan1977,https://www.tripadvisor.com/Profile/Lachlan1977,https://media-cdn.tripadvisor.com/media/photo-o/1a/f6/eb/6d/default-avatar-2020-19.jpg,,5,Jan 2024 • Family,Great private transfer service,On time and reliable. Good internet site for easy booking. Nothing more to say but need to make 100 characters! ,0,,"Written January 5, 2024",This review is the subjective opinion of a Tripadvisor member and not of Tripadvisor LLC.,On time and reliable.Good Internet Site for Easy Booking.NOHING MORE TO SAY BUT NEED TO MAKE 100 CHARACTERS!
mtwondries,https://www.tripadvisor.com/Profile/mtwondries,https://media-cdn.tripadvisor.com/media/photo-o/1a/f6/e3/6a/default-avatar-2020-47.jpg,,5,Dec 2023 • Family,Excellent Service,"Highly recommend Donny and the team from NYC Perfect! On time, friendly and professional. We had 6 transfers to cover a group of 9 (ages 15 to 80) from various locations. All vehicles were in pristine condition with all the amenities needed. Drivers were helpful and polite. Donny was quick to respond and very accommodating as needs changed. Will definitely use again. ",0,,"Written January 4, 2024",This review is the subjective opinion of a Tripadvisor member and not of Tripadvisor LLC.,"Highly Recommended Donny and The Team from Nyc Perfect!On Time, Friendly and Professional.We had 6 transfers to cover a Group of 9 (Ages 15 to 80) from Various Locations.All vehicles were in pristine condition with all the amenities Needed.Drivers Were Helpful and Polite.Donny Was Quick to respond and see accommodating as Needs Changed.Will Definitely Use Again."
Scott P,https://www.tripadvisor.com/Profile/scottp836,https://media-cdn.tripadvisor.com/media/photo-o/1a/f6/ef/9c/default-avatar-2020-14.jpg,"Kirkcaldy, UK",5,Dec 2023 • Family,Perfect from start to finish !,It was our first trip to the USA from the U.K. and our daughters birthday as well.<br />Wanted to book something special so after doing lots of reviews decided to book NYC !<br />Easy booking process and our driver was early and happy to wait till we cleared customs.<br />Charles was our driver and what a guy! Had us all laughing at points and his knowledge was second to none . Really set us up nicely after our flight and what he doesn’t know about NY probably isn’t worth knowing!<br />Gave us lots of useful advice and despite us arriving at rush hour he was calm as could be even when we hit city traffic .<br />We had a black Escalade which just happened to be my favourite car so couldn’t have been better.<br />Will definitely use you guys again in future,0,,"Written January 1, 2024",This review is the subjective opinion of a Tripadvisor member and not of Tripadvisor LLC.,It was our first trip to the use from the u.k.and Our Daughters Birthday as Well. <br /> Wanted to Book Subshing Special So Aftering Doing Lots of Reviews Decided To Book Nyc!/> Charles Was Our Driver and What A Guy!Had us all laughing at points and his knowledge was second to none.REALLY SET US UP NICELY AFTER OUR FLIGHT AND WHAT HE DOESN't KNOW ABOUT NY PROBABLY ISN´T Worth Knowing!Hit City Traffic.
Mick B,https://www.tripadvisor.com/Profile/janetb922,https://media-cdn.tripadvisor.com/media/photo-o/1a/f6/e4/2d/default-avatar-2020-48.jpg,"Riccall, UK",5,Jan 2024 • Family,Great from start to finish,Excellent from start to finish. Just arrived back from New York and cannot fault the transfers.  Donny even helped and advised as we didn’t know New York roads shut down early on New Year’s Eve and we would have been stuck getting to the airport for our evening flight.  The cars were spotless and the drivers communicated via what’s app as soon as we landed and gave us lots of notice when we were being collected from the hotel.  A shout out to Mark who gave me lots of tips and information on the way to our hotel and made the journey go really quick even though we were stuck in traffic.  I would definitely use this company again and getting the meet and greet on our arrival just took the pressure off as it was the first time I had travelled on my own with my son.  The one thing I would suggest is to add at least an hour to hour and a half onto your landing time for pick up collection time as passport control was so busy so you may miss your transfer.,0,,"Written January 1, 2024",This review is the subjective opinion of a Tripadvisor member and not of Tripadvisor LLC.,EXCELLENT FROM START TO FINISH.Just Arrived Back from New York and Cannot Fault the Transfers.Donny Even Helped and Advised As We Didn’t Know New York Roads Shut Down Early On New Year’s Eve and We Would Have Been Stuck Getting To The Airport For Our Evening Flight.The Cars Were Spotless and the Drivers Communicated Via What’s App As So We Landed and Gave Us Lots of Notice When We Were Being Collected from The Hotel.A Shout Out To Mark Who Gave Me Lots of Tips and Information on The Way To Our Hotel and Made The Journey Go Really Quick Even Though We Were Stuck in Traffic.I WOULD DEFINITELY USE THIS COMPANY AGAIN AND GETTING THE MEET AND GREET ON OUR ARRIVAL JUS TOOK THE PRESSURE OFF AS IT WAS THE First TIME I HAD TRAVELED ON MY OWN WITH MY SON SON.The One Thing I Wouled Suggest is to Add At Least An Hour To Hour and a Half Onto Your Landing Time for Pick Up Collection Time As Passport Control Was So Busy So You May Miss Your Transfer.
Myrto2023,https://www.tripadvisor.com/Profile/Myrto2023,https://media-cdn.tripadvisor.com/media/photo-o/1a/f6/ef/32/default-avatar-2020-12.jpg,,5,Dec 2023 • Family,Perfect indeed,"My underage daughter travelled alone and used their services; driver was polite, on time and easy to contact, car was clean and overall service was impeccable",0,,"Written December 29, 2023",This review is the subjective opinion of a Tripadvisor member and not of Tripadvisor LLC.,"My Underage Daughter Travelled Alone and used their services;Driver was Polite, On Time and Easy To Contact, Car Was Clean and Ovell Service was impeccable"
179stephen,https://www.tripadvisor.com/Profile/179stephen,https://media-cdn.tripadvisor.com/media/photo-o/1a/f6/e4/a9/default-avatar-2020-50.jpg,,5,Dec 2023 • Family,Awesome,Will definitely use next time in NY. Early arrival and very courteous and helpful drivers. Very clean and nice vans. Luxurious. ,0,,"Written December 28, 2023",This review is the subjective opinion of a Tripadvisor member and not of Tripadvisor LLC.,Will Definitely Use Next Time In Ny.Early Arrival and Vary Courteous and Helpful drivers.Vary Clean and Nice Vans.Luxurious.
jjkimbro10,https://www.tripadvisor.com/Profile/jjkimbro10,https://media-cdn.tripadvisor.com/media/photo-o/1a/f6/f0/d5/default-avatar-2020-17.jpg,,2,Dec 2023 • Family,Poor Communication,"I called this company based on the ratings from TripAdvisor. Donny was not clear with communication. He reluctantly booked our transportation to the hotel. I tried to reserve a sprinter van for our return to the airport and found Donny to be quite rude and dismissive. I emailed per his instructions to no avail! After waiting for several weeks,  I booked with another company. I will say our driver to the hotel, Charles, was great!!",0,,"Written December 23, 2023",This review is the subjective opinion of a Tripadvisor member and not of Tripadvisor LLC.,"I CALLED THIS COMPANY BASED ON THE Ratings From TripAdvisor.Donny Was Not Clear with Communication.I have shone Booked Our Transportation to the hotel.I tried to reserve Sprinter van for our return to the airport and foundy to be remote Rude and Dismsive.I EMAILED PER HIS INSTRUCTIONS TO NO AVAIL!After Waiting for Several Weeks, I Booked with Another Company.I Will Say Our Driver to The Hotel, Charles, was great !!"
Trip793795,https://www.tripadvisor.com/Profile/Trip793795,https://media-cdn.tripadvisor.com/media/photo-o/1a/f6/f1/b8/default-avatar-2020-22.jpg,,5,Dec 2023,Excellent service from beginning to end,"We used NYC perfect transportation on both journeys from the airport and to the airport. On arrival to NYC Miguel picked us up who was professional and communicated with us whilst he waited for us. On the way back we had Charles who's conversation was absolutely class, very funny with great knowledge of NYC and its suburbs. Excellent will use again ",0,,"Written December 23, 2023",This review is the subjective opinion of a Tripadvisor member and not of Tripadvisor LLC.,"WE USED NYC Perfect Transportation On Bourneys From The Airport and To The Airport.On subrival to nyc miguel picked US up Who was Professional and Communicated with Us Whilst He Waited for Us.On The Way Back We Had Charles Who's Conversation was Absolutely Class, Vary Funny With Great Knowledge of Nyc and ITS Suburbs.EXCELLENT Will Use Again"
4pearsVA,https://www.tripadvisor.com/Profile/4pearsVA,https://media-cdn.tripadvisor.com/media/photo-o/1a/f6/e3/1f/default-avatar-2020-46.jpg,"Roanoke, VA",5,Dec 2023 • Family,"Professional, on time, worth the price","We had a great experience to and from LAG. Drivers were early, professional, and most important—they were safe drivers! I would definitely use this service again.",0,,"Written December 20, 2023",This review is the subjective opinion of a Tripadvisor member and not of Tripadvisor LLC.,"We had a great experience to and from lag.Drivers Were Early, Professional, and Most Important - They Were Safe Drivers!I WOULD DEFINITELY USE THIS SERVICE AGAIN."
JakeDeo,https://www.tripadvisor.com/Profile/JakeDeo,https://media-cdn.tripadvisor.com/media/photo-o/1a/f6/e5/66/default-avatar-2020-53.jpg,"Kingston, Canada",4,Dec 2023 • Family,Fantastic experience overall,"I had a lot of difficulty trying to decide on a service to hire for our trips from and to the airport. We'd never been to New York and didn't have any contacts in the area so I read the reviews and settled on NYC Perfect Transportation. I'm very happy with my decision.<br /><br />I received automated confirmation emails about my reservation which were helpful but I was unable to confirm over the phone a few days in advance. I imagine they were busy and I was calling about a future reservation which they were confirming via their automated service so that may have just slipped through the cracks.<br /><br />The drivers were fantastic (Marwan in particular was very welcoming, knowledgeable, and helpful), cars were immaculate and communication for pick up was smooth and easy. <br /><br />The only reason I didn't give 5 stars is that for our trip back to the airport, the driver did not have the requested booster seat. It was noted on the reservation but the driver said he hadn't been made aware. We were able to get my daughter situated safely enough as she's almost at the height where she won't need one anymore but this is the only complaint I had.<br /><br />I would highly recommend this service to anyone looking for transportation in NYC. If you have special requests on your reservation, just be sure to confirm them in advance the day of.<br /><br />",0,,"Written December 18, 2023",This review is the subjective opinion of a Tripadvisor member and not of Tripadvisor LLC.,"I had a Lot of Difficulty Trying to decide on Service to Hire for Our Trips from and to the airport.We'd Never Been To New York and Didn't Have Any Contacts in The Area So I Read the Reviews and Settled On Nyc Perfect Transportation.I'M VERY HAPPY WITH MY DECISSION.I imagine they were busy and i was calling about, Knowledgeable, and Helpful), Cars were Immaculate and Communication for Pick Up was Smooth and Easy.<br /> <br /> The Only Reason I Didn't Give 5 Stars Is That For Our Trip Back To The Airport, The Driver Did Not Have The Clock Booster Seat.It was noted on the reservation but the driver said he had't been made aware.We were Uble to Get My Daughter Site Safely Enough As She's Almost at The Height Where She Won't Need One Anymore But This is the Only Complaint I Had. <br />FOR TRANSPORTATION IN NYC.If you have spects on your reservation, Just Be Sure to Confirm Them in Advance The Day of. <br /> <br />"
ny87402,https://www.tripadvisor.com/Profile/ny87402,https://media-cdn.tripadvisor.com/media/photo-o/1a/f6/df/2b/default-avatar-2020-39.jpg,"Farmington, NM",5,Dec 2023 • Family,NYC Visit,"5 Stars; preplanning including pick-up, drop-off points and appropriate timing to satisfy reaching planned events.  Ag appropriate booster seats included, Driver professional, courteous and flexible.",0,,"Written December 14, 2023",This review is the subjective opinion of a Tripadvisor member and not of Tripadvisor LLC.,"5 stars;PREPLANNING INCUSTUDING Pick-UP, DROP-OFF POINTS AND APPROPRIATE TIMING TO SATISE REACING PLANNED EVESS.AG APPROPRIATE BOOSTER SEATS INCUEDED, DRIVER PROFESSIONAL, COURTEOUS AND FLEXIBLE."
maryN6274NA,https://www.tripadvisor.com/Profile/maryN6274NA,https://media-cdn.tripadvisor.com/media/photo-o/1a/f6/e4/ca/default-avatar-2020-51.jpg,"Santa Fe, NM",5,Nov 2023,What a Relief Riding into and out of NYC!,"Donny set my mind and heart at ease by scheduling the ride we needed. Joey text-guided us thru the airport to find his ""Tank"" - a Cadillac Escalade - lap of luxury! Joey's driving was sure-footed and calming, even through the post-Thanksgiving holiday traffic! Same guidance on the return to La Guardia with Joey -<br />NYC lives up to it's name: Perfect Transportation! Thanks, Mary ",0,,"Written December 13, 2023",This review is the subjective opinion of a Tripadvisor member and not of Tripadvisor LLC.,"Donny Set My Mind and Heart at Ease By Scheduling The Ride We Needed.Joey Text -IDEd Us Thru The Airport To Find His ""Tank"" - A Cadillac Escalade - Lap of Luxury!Joey's Driving was Sure-Foted and Calming, Even Through the post-thanksgiving holiday traffic!SAME GUIDANCE ON THE RETURN TO THE GUARD WITH JOEY -<br /> NYC LIVES UP TO IT'S NAME: PERFECT TRANSPORTATION!Thanks, Mary"
Ayşegül,https://www.tripadvisor.com/Profile/aysegulloz,https://media-cdn.tripadvisor.com/media/photo-o/1a/f6/eb/a3/default-avatar-2020-38.jpg,"Istanbul, Türkiye",5,Jan 2024 • Friends,new york trip,"What set our NYC limo tour apart was the attention to detail, including our impeccably dressed driver who exuded professionalism. It was reassuring to have a chauffeur in formal attire, adding an extra layer of sophistication to our journey through the city. Limo itself was brand new, driver Mike was flexible and extremely nice at the same time. Plus we got to customize the tour based on our preferences. We did a downtown tour where we saw Financial District, Charging Bull...",0,,"Written February 20, 2024",This review is the subjective opinion of a Tripadvisor member and not of Tripadvisor LLC.,"What Set Our Nyc Limo Tour Apart Was The Attention to Detail, Including Our Impecly Dressed Driver Who Exuded Professionalism.It was reassuring to have a chauffeur in formal attire, Adding an extra layer of sophistication to Our Journey Through the City.Limo Itself was brand new, driver mike was flexible and Extremely Nice at The Same Time.Plus We Got To Customize The Tour Based On Our Preferences.We Did A Downtown Tour Where We Saw Financial District, Charging Bull ..."
Anderson P,https://www.tripadvisor.com/Profile/S8547OJandersonp,https://media-cdn.tripadvisor.com/media/photo-o/1a/f6/f2/7a/default-avatar-2020-25.jpg,,5,Jul 2023 • Friends,Tour with friends,"You guys exceeded all expectations! Our group booked a coach bus for a corporate event in NYC, and we were thoroughly impressed. The bus was luxurious and well-maintained, with comfortable seating and onboard facilities including a bathroom, which made our commute stress-free. Their seamless shuttle service ensured that we arrived at our destinations promptly. Will definitely use their services again.",0,,"Written February 19, 2024",This review is the subjective opinion of a Tripadvisor member and not of Tripadvisor LLC.,"You Guys Exceeded All Expectations!Our Group Booked A Coach Bus for Corporate Event in Nyc, and We Were Thoroughly Printed.The Bus was luxurious and well-maintoined, with comforible Seating and Onboard facilities including a Bathroom, which made our community stress-farm.Their Seamless Shuttle Service Reured That We ArRIled at Our Destination Promptly.Will Definitely use their services again."
京佳 山,https://www.tripadvisor.com/Profile/_F7073NC,https://media-cdn.tripadvisor.com/media/photo-o/1a/f6/e8/91/default-avatar-2020-62.jpg,,5,Sep 2023 • Friends,Tour with my friend s,"King and Queen made our NYC trip unforgettable! The coach bus we rented for our wedding party was nothing short of amazing. It was spacious, elegant, and extra leg room onboard was a godsend for our bridal party. Their shuttle service was seamless, ensuring that everyone arrived at the venues on time.",0,,"Written February 19, 2024",This review is the subjective opinion of a Tripadvisor member and not of Tripadvisor LLC.,"King and Queen Made Our Nyc Trip Unforgetable!The Coach Bus We Renned for Our Wedding Party was nothing short of Amazing.It was spacious, Elegant, and extra leg room onboard was to Godsend for our Bridal Party.Their Shuttle Service was Seamless, Reninging That Everyone Arrided at The Venues On Time."
Aden K,https://www.tripadvisor.com/Profile/203adenk,https://media-cdn.tripadvisor.com/media/photo-o/1a/f6/e9/60/default-avatar-2020-64.jpg,,5,Jul 2023 • Friends,Tour with friends,"We had a blast on our night out, all thanks to King and Queen Limousine! Cruising around NYC for 3 hours in their Stretch Limo was next-level awesome. It felt super luxurious to see all the famous spots that way. Plus, our driver totally rocked, making sure we had the best time. Seriously, if you want to make any event epic, King and Queen Limousine is the way to go!",0,,"Written February 19, 2024",This review is the subjective opinion of a Tripadvisor member and not of Tripadvisor LLC.,"We had a blast on Our Night out, All Thanks to King and Queen Limousine!Cruising Around NYC for 3 Hours in Their Stretch Limo was Next-Level Awesome.It Felt Super Luxurious to See All The Famous Spots That Way.Plus, Our Driver Totally Rocked, Making Sure We Had the Best Time.Seriously, If you want to make any event epic, King and Queen Limous is the way to go!"
Yaren G,https://www.tripadvisor.com/Profile/837yareng,https://media-cdn.tripadvisor.com/media/photo-o/1a/f6/f1/06/default-avatar-2020-18.jpg,,5,Dec 2023 • Solo,Exceeded expectations perfectly!,King and Queen exceeded our expectations for our NYC Airport transfer. Their proactive approach to tracking our flight meant they were ready and waiting for us upon arrival. Their assistance with luggage and friendly demeanor made the journey stress-free.,0,,"Written February 17, 2024",This review is the subjective opinion of a Tripadvisor member and not of Tripadvisor LLC.,King and Queen Exceleded Our Expectations for Our Nyc Airport Transfer.Their Proactive Approach To Tracking Our Flight Meant They Were Ready and Waiting for Upon Arrival.Their Assistance With Luggage and Friendly Demeanor Made The Journey Stress-Free.
