User Name,User Profile,User Avatar,User Location,Rating,Rating Text,Review Title,Review Text,Helpful Votes,Photos,Published Date,Disclaimer,Review_Text_english
Emabob36,https://www.tripadvisor.com/Profile/Emabob36,https://media-cdn.tripadvisor.com/media/photo-m/1280/2a/a6/1e/b9/caption.jpg,"Shrewsbury, UK",1,Dec 2021 • Couples,Take a yellowcab!,"Ordered VIP car for transfer into city weeks in advance. Clearly stated in my booking we had 3 suitcases too, we needed a bigger vehicle. <br />Flight landed early, got email to say driver assigned and for me to text when we have bags. I text… nothing. So I text again… nothing. I called, they hung up. I called again and again and again. After waiting 40 minutes AFTER I’d gotten my bags, someone finally picked up the phone after more than 10 calls. He kindly told me I needed to wait at least another 15 minutes! No apologies, they were just not interested at all. I told them to cancel the booking and how upset I was… nothing still, just “okay, that’s cancelled” The usual human response when you’ve screwed up is “I’m sorry, what can we do to fix it?” <br />We went back to the tank and caught a taxi, which is what I should’ve done in first place rather than pay more than THREE times the cost to be left standing outside waiting for a car that was clearly never going to arrive. Moral of story - don’t bother with Dial7",0,,"Written January 15, 2022",This review is the subjective opinion of a Tripadvisor member and not of Tripadvisor LLC.,"Ordered Vip Car for Transfer Into City Weeks in Advance.Clearly Stated in My Booking We Had 3 Too Suitcases, We Needed A Bigger Vehicle.<br /> Flight Landed Early, Got Email to say driver assigned and for me to text when we have bags.I text ... nothing.So i text again ... nothing.I CALLEED, They Hung Up.I CALLED AGAIN AND AGAIN AND AGAIN.After Waiting 40 Minutes After I’d Gotten My Bags, Somone Finally Picked Up The Phone after More than 10 Calls.HE KINDLY TOLED ME I NEEDED TO WAIT AT LEAST ANOTHER 15 MINUTES!No Apologies, They were just not intersted at all.I awd them to cancel the booking and how upset i was ... nothing still, just<br /> We went back to the tank and caught a taxi, which is what i should've done in first place rather than pay more than Three Times the Cost to Be Left Standing outside waiting for a car that was Clearly Never Going toArriveMoral of Story - Don’t Bother with dial7"
Paul O,https://www.tripadvisor.com/Profile/G2059GCpaulo,https://media-cdn.tripadvisor.com/media/photo-o/1a/f6/f3/e4/default-avatar-2020-30.jpg,,2,Dec 2021 • Couples,Watch out for the switcheroo,Paid for the VIP level airport transport which is priced above a premium car cost wise and ended up in a beat up old Lincoln. Scam ,0,,"Written December 23, 2021",This review is the subjective opinion of a Tripadvisor member and not of Tripadvisor LLC.,Paid for the Vip Level Airport Transport Which is priced advocates Premium Car Cost Wise and Ended Up in A Beat Up Old Lincoln.SCAM
LA1005,https://www.tripadvisor.com/Profile/LA1005,https://media-cdn.tripadvisor.com/media/photo-o/14/06/63/76/louise-a.jpg,"Columbia, SC",5,Oct 2021,Excellent service,"We used Dial 7 car service round trip LGA to Soho last weekend in Oct. communication was great, text when we landed with exact location to meet car. On return request was for a 10:15 am pickup and got text at 10am that car was onsite.. very clean vehicles and courteous drivers. Will recommend to anyone.",0,,"Written November 12, 2021",This review is the subjective opinion of a Tripadvisor member and not of Tripadvisor LLC.,"We used dial 7 car service round trip lga to soho lat Weekend in Oct. Communication was great, text when we landed with exact location to meet car.On return was was for 10:15 am pickup and drop text at 10am that car was onsite .. Vray Clean Vehicles and Courteous Drivers.Will Recommend to Anyone."
Scott B,https://www.tripadvisor.com/Profile/Scott1California,https://media-cdn.tripadvisor.com/media/photo-f/01/2e/70/7f/avatar066.jpg,California,1,Nov 2021,"Reserved Limo Never Arrived for JFK (was told ""no cars available- find a taxi"")","I have used this company MANY times preCovid.  I always use it to get from Manhattan to JFK, booking the day prior.  I booked a trip in Nov 2021 for 8AM pickup from Midtown hotel to JFK.  I received a text message at 7:45AM that limo was en route.  At 8:15AM, no car.  I called and they said ""no cars are available in your area"".  I said I booked my reservation 24 hours prior and they said to find another form of transportation.  I was able to get a cab (actually very easy and half the price) and arrived at gate during final boarding call.  Never again.  Completely unprofessional.  Almost missed my 6.5 hour flight!",0,,"Written November 8, 2021",This review is the subjective opinion of a Tripadvisor member and not of Tripadvisor LLC.,"I have used This Company Many Times early.I ALways use it to get from Manhattan to JFK, Booking The Day Prior.I Booked to Trip In Nov 2021 For 8am Pickup From Midtown Hotel To Jfk.I receive text Message at 7:45 am that Limo Was in Route.At 8:15 am, no car.I Calleed and They Said ""No Cars Are Available in Your Area"".I SAID I BOOKED MY RESERVATION 24 Hours Prior and They Said To Find Another form of transportation.I was Able to Get A CAB (Actually Vry Easy and Half the Price) and Arrided at Gate During Final Boarding Call.Never Again.COMPLETELY UNPROFESIONAL.ALMOST MISSED MY 6.5 HOUR FLIGHT!"
Rafael Martins Costa,https://www.tripadvisor.com/Profile/Rafaeldmc,https://media-cdn.tripadvisor.com/media/photo-o/1a/f6/f4/5d/default-avatar-2020-32.jpg,,5,Oct 2021,GREAT TOUR EXPERIENCE,"Por diversas vezes já utilizei os serviços. A cordialidade, segurança na direção, além de muitas dicas sobre a cidade e a região, tornaram os deslocamentos muito aprazíveis.",0,,"Written October 28, 2021",This review is the subjective opinion of a Tripadvisor member and not of Tripadvisor LLC.,"For various time, I used the services.To cordiality, Segurança na direção, além de muitas dicas on a cidade e a região, turned the Diseases muito aprazíveis."
Marcos S,https://www.tripadvisor.com/Profile/marcossT5219TF,https://media-cdn.tripadvisor.com/media/photo-o/1a/cf/cf/94/caption.jpg,"Criciuma, SC",5,Jan 2020 • Family,Sejam bem vindos a Nova York!,"Estavamos indecisos quanto ao nosso deslocamento do aeroporto até o hotel em NY.<br />Optamos pelos serviços da Braztours, até então desconhecido por .<br />Foi uma grata surpresa. Fomos muito bem recebidos pelo Alex, um londrinense , ainda com sotaque do Paraná, que esta a 16 anos em NY.<br />Nosso transfer foi com direito a boas dicas e musica de entrada em Manhattan!!<br />No retorno também optamos pelo mesmo serviço. Nossa filha esqueceu o celular na van, mas assim que percebeu , nos levou de prontidão!<br />Super recomendo!",0,https://media-cdn.tripadvisor.com/media/photo-m/1280/1a/c6/a6/91/photo0jpg.jpg,"Written February 1, 2020",This review is the subjective opinion of a Tripadvisor member and not of Tripadvisor LLC.,"Let us be undecided quanto ao nosso Delocation of Airport Até or Hotel Em ny.Fomos Mitito Bem Recorded Alex Hair, Um Londrinense, Ainda Com Sotaque do Paraná, which is 16 years em ny.We also optiço mesmo.Nossa Filha Esqueceu or Cell Na van, more Assim than Percoeu, we will read weir! <br /> Super recommend!"
Mariana M,https://www.tripadvisor.com/Profile/MarianaM762,https://media-cdn.tripadvisor.com/media/photo-o/1a/f6/ea/2e/default-avatar-2020-67.jpg,"Sao Paulo, SP",5,Mar 2019 • Family,Simpatia e pontualidade,"Vamos à muitos anos para NY e sempre contratamos os serviços do Alex que com toda sua simpatia, paciencia com os meus pais, pontualidade fazem toda a diferença na viagem! Um serviço mais caro mas que vale pena por todo o conforto e confiança!",0,,"Written November 28, 2019",This review is the subjective opinion of a Tripadvisor member and not of Tripadvisor LLC.,"We are going very years for ny e semi we hired the service of Alex that as all sua sympathy, patience com os meus country, pontificuality fazem all to difference na viagem!Um Serviço Mais Caro more that is worth sorrow for everything or comforted e confiança!"
ricardopapa93,https://www.tripadvisor.com/Profile/ricardopapa93,https://media-cdn.tripadvisor.com/media/photo-o/1a/f6/77/ae/default-avatar-2020-2.jpg,"Goiania, GO",5,Oct 2019 • Family,Muito bom,"Fomos a Nova York no dia 20 de outubro. Fomos levados ao hotel pelo motorista Sérgio, que é muito atencioso e nos deu várias dicas. O processo de reserva foi muito ágil. No retorno não houve disponibilidade de motorista para a data e hora que queríamos e o Alex nós veio informando com clareza o tempo todo. Contrataria a empresa novamente com certeza.",0,,"Written October 27, 2019",This review is the subjective opinion of a Tripadvisor member and not of Tripadvisor LLC.,"Fomos to Nova York no day 20 of Outubro.Fomos Levados Ao Hotel Happy Motorist Sérgio, who very careful and we deu Vária Dicas.Or reserve process foi muito agile.I do not return no Houve Availability of Motorist for a data and time that we wanted e o Alex Nós Veio informing Com Claraza or Tempo EVERYTHING.I would hire the company Novia Com Certeza."
MariaRipperKos,https://www.tripadvisor.com/Profile/MariaRipperKos,https://media-cdn.tripadvisor.com/media/photo-s/0f/e7/86/70/mariaripperkos.jpg,"Rio de Janeiro, RJ",5,Oct 2019,Atendimento nota 10! Recomendo!,"Fizemos o transfer do JFK para Manhattan, ida e volta, e um tour com o Alex. Foi tudo excelente!!! Recomendo fortemente!!!",0,,"Written October 19, 2019",This review is the subjective opinion of a Tripadvisor member and not of Tripadvisor LLC.,"Let us easily or transfer for Manhattan, Ida e Volta, and Um Tour com or Alex.Foi tudo excellent !!!I fortifically recommend !!!"
Silva M,https://www.tripadvisor.com/Profile/Marcos-NeumaSilva,https://media-cdn.tripadvisor.com/media/photo-o/1b/84/53/2d/silva-m.jpg,"Sao Paulo, SP",5,Jun 2019,"Braztours Nova York, NY 11102","Braztours - Nova York, NY 11102 foi a terceira vez que estivemos aqui e a cada vez, nos surpreendemos. Venham todos!!! <br />Braztours - New York, NY 11102 was the third time we were here and each time we were surprised. Everyone come!!!",0,,"Written October 10, 2019",This review is the subjective opinion of a Tripadvisor member and not of Tripadvisor LLC.,"Braztours - Nova York, NY 11102 FOI A TERCEIRA TIME WE SIGN HERE E AT A EVERY AGE, WE SORPREDE ourselves.Venham all !!!<br /> Braztours - New York, NY 11102 was The Third Time We Were and Each Time We Were Surprised.Everyone eats !!!"
Aydar S,https://www.tripadvisor.com/Profile/AydarS_13,https://media-cdn.tripadvisor.com/media/photo-o/19/33/55/90/caption.jpg,"Kazan, Russia",5,Aug 2019,Самая главная площадь мира!,"Каждый раз приезжая в Нью Йорк, обязательно спешу вечером на Time Square, главну площадь планеты! Каждый раз там происходит что- то новое, интересное. Я уже не говорю о количестве неоновой рекламы!",0,,"Written September 8, 2019",This review is the subjective opinion of a Tripadvisor member and not of Tripadvisor LLC.,"Каждый раз приезжая в нью йорк, бязатеьно с вечером на Time Square, гавну пощадь панеты!Каждый р т р п п р р р р р р р р р р р р.Я же не говорю ооличестве неоновой рекамы!"
Maria C,https://www.tripadvisor.com/Profile/MariaC11606,https://media-cdn.tripadvisor.com/media/photo-o/1a/f6/de/e7/default-avatar-2020-37.jpg,,5,Aug 2019,I enjoy this famous part of New York,"Big buildings, big electronics signs, a lot people shopping, you don't feel the time. We enjoy the big apple.",0,,"Written August 20, 2019",This review is the subjective opinion of a Tripadvisor member and not of Tripadvisor LLC.,"Big Buildings, Big Electronics Signs, Lot People Shopping, You Don's Feel The Time.We Enjoy The Big Apple."
Jacqueline Jones,https://www.tripadvisor.com/Profile/jacquelinejY4843HY,https://media-cdn.tripadvisor.com/media/photo-s/15/22/b3/00/jacqueline-j.jpg,"Rochester, NY",5,Jul 2019,great tour expereience,I was nice to be able to see all the sits during the tour which takes you to all the key stops along the tour in the comfort of the bus ride as well with a guided tour guide.,0,,"Written August 7, 2019",This review is the subjective opinion of a Tripadvisor member and not of Tripadvisor LLC.,I was nice to be uble to see all the sits during the tour whoich takes you to all the key stops along the tour in the comfort of the bus ride well with a Guided Tour Guide.
Anselmo T,https://www.tripadvisor.com/Profile/anselmot2013,https://media-cdn.tripadvisor.com/media/photo-m/1280/19/32/55/1b/anselmot2013.jpg,"Sao Paulo, SP",5,Jul 2019 • Family,Excelente ,Já utilizamos os servicos do Alex várias vezes.  Sempre com pontualidade e excelente atendimento. Indico para quem está necessitando de transporte em New York.<br />,0,,"Written July 30, 2019",This review is the subjective opinion of a Tripadvisor member and not of Tripadvisor LLC.,"Já we use the Servicos do Alex Várias time.Semi -com pontuality and excellent attending.I indicate for burning, it is needing transporting em new york. <br />"
Sumara L,https://www.tripadvisor.com/Profile/SumaraL,https://media-cdn.tripadvisor.com/media/photo-o/1a/f6/f2/59/default-avatar-2020-24.jpg,"Sao Paulo, SP",5,Jun 2019 • Friends,Excelente atendimento!!!,"Eu e minha família conhecemos o Alex a 10 anos e sempre que vamos a NYC utilizamos os serviços da sua empresa. Sempre somos muito bem atendidos!! O atendimento é excelente, o carro é confortável, em ótimo estado de conservação e o Alex conhece muito bem a cidade e é muito gentil e atencioso! Super indico!!! ",0,,"Written July 2, 2019",This review is the subjective opinion of a Tripadvisor member and not of Tripadvisor LLC.,"EU E E MINHA FAMÍLIA We can or Alex 10 years old and we are going to NYC we use the company.SEMPRE WE MUITO BEM attended !!O Attended and excellent, or car and comfort, empty state of preservoção e o Alex Conchece Bem a Cidade and é é mutilo and careful!Super Indico !!!"
Markéta K,https://www.tripadvisor.com/Profile/863mark_tak,https://media-cdn.tripadvisor.com/media/photo-o/1a/f6/f3/23/default-avatar-2020-28.jpg,"Prague, Czech Republic",5,May 2019 • Couples,tak tady to žije,"určitě nesmíte zapomenout na toto místo při návštěvě NYC. Ta atmosféra a ta spousta lidí je součást tohoto místa. Nejlepe vyrazit večer, kdy je místo krásně osvětlené.",0,,"Written June 3, 2019",This review is the subjective opinion of a Tripadvisor member and not of Tripadvisor LLC.,"Určitě Nesmíte Zapomenout Na Toto Míto Při Návštěvě Nyc.Ta atmosféra a ta spausta lidí je součást tohoto mysta.Nejlepe Vyrazit Večer, Kdy Je Místo Krásně Osvětlené."
Nicola Z,https://www.tripadvisor.com/Profile/672nicolaz,https://media-cdn.tripadvisor.com/media/photo-o/1a/f6/ea/2e/default-avatar-2020-67.jpg,,5,Jun 2018,tour per la city,"stanchi di camminare dopo giorni,abbiamo deciso di fare un tour per la citta' con i mezzi comodi e lussuosi della braztours,che costano meno che in italia.personale gentilissimo e divertente,il tutto e' stato molto piacevole.",0,,"Written April 29, 2019",This review is the subjective opinion of a Tripadvisor member and not of Tripadvisor LLC.,"Stanchi di Camminare Dopo Giorni, Abbiamo said a fare a tour per the cita 'with I mezzi comodi e lussuosi della braztours, Che Costano Meno Che in Italy. Personale Gentilissimo and divertent, il tutto e' Stato Molto Piacevole."
GuJu Martins,https://www.tripadvisor.com/Profile/juniamaciel,https://media-cdn.tripadvisor.com/media/photo-o/16/fe/45/f7/caption.jpg,"Belo Horizonte, MG",5,Mar 2019 • Family,NY com família!,"Contratamos o serviço da Braztours e ao chegar fomos recebidos pelo Sr. Desmond, uma pessoa agradabilíssima e com boas dicas para cegada. Para irmos embora, em virtude da boa recepção, contratamos novamente o serviço da empresa e dessa vez fomos atendidos pelo Alex, pessoa igualmente agradável e prestativa como o Desmond. Valeu a pena! ",0,"https://media-cdn.tripadvisor.com/media/photo-m/1280/16/ef/5a/a5/photo1jpg.jpg
https://media-cdn.tripadvisor.com/media/photo-m/1280/16/ef/5a/a3/photo0jpg.jpg","Written March 25, 2019",This review is the subjective opinion of a Tripadvisor member and not of Tripadvisor LLC.,"We hire or serve braztours e ao chegar fomos renowned hair Mr. Desmond, uma pessoa pleasantly e com Boas dicas for blinding.To Irmos Ambo, Em Virtue Da Boa Receção, we hired novice or Serviço da company and desa time fomes attended Alex hair, heavy is also pleased and lenders as or desmond.Valeu A Pena!"
Kamila C,https://www.tripadvisor.com/Profile/kamilacoelho,https://media-cdn.tripadvisor.com/media/photo-s/0b/c1/32/d5/kamila-c.jpg,,5,Dec 2018 • Family,Excelente!,"Serviço excelente! Atendimento incrível do começo ao fim! Super recomendo!!  Fiz tour de 6 horas e traslado do aeroporto, carro mega confortável e passeio maravilhoso.",0,,"Written March 6, 2019",This review is the subjective opinion of a Tripadvisor member and not of Tripadvisor LLC.,"Excellent Serviço!Attended food do comuso ao fim!Super recommend !!6 -hour tour Tour and Transfer Do Airport, Mega Confortável and Passeio Maravilos."
Victor S,https://www.tripadvisor.com/Profile/123victors,https://media-cdn.tripadvisor.com/media/photo-o/1a/f6/eb/43/default-avatar-2020-11.jpg,"Sao Luis, MA",5,Feb 2019 • Couples,Excelente ,"Excelente atendimento! O Alex foi muito paciente, atencioso e prestativo. Nosso voo chegou no horário, mas os procedimentos de imigração no aeroporto foram extremamente lentos (muita gente e poucos funcionários). Mesmo assim, o Alex aguardou com paciência, nos brindou com Frank Sinatra (New York, New York) na entrada da Cidade, e nos levou até ao hotel conforme combinado. Muito bom!!!",0,,"Written February 24, 2019",This review is the subjective opinion of a Tripadvisor member and not of Tripadvisor LLC.,"Excellent attending!Or Alex Foi Muito patient, careful and provision.Nosso Voo Chegou Non Hulário, but Imigração no Aeroporto Foram Extremely slow (muita people and Poucos functional).Mesmo Assim, or Alex Aguardou Com Paciência, I gave us Com Frank Sinatra (New York, New York) na entrance of Cidade, and we will take us to the hotel as combined.Muito bom !!!"
Silvio,https://www.tripadvisor.com/Profile/silvios1960,https://media-cdn.tripadvisor.com/media/photo-o/1a/f6/eb/e3/default-avatar-2020-59.jpg,,5,Feb 2019 • Family,motorista muito atencioso,"Contramos a equipe Braztours para fazer nossos translados do aeroporto em Nova Jersey para o hotel perto do Central Park, o motorista Alex que nos buscou na nossa chegada foi super atencioso com dicas da cidade para nossa familia, gostaria muito de agrader pelo carinho e prestaza. Voltaremos a usar com certeza e indicar aos nossos amigos.",0,,"Written February 11, 2019",This review is the subjective opinion of a Tripadvisor member and not of Tripadvisor LLC.,"We contradict Equipe Braztours to Fazer Transaded Nossos do Airport Em Nova Jersey for or Hotel Repeo do Central Park, or Motorist Alex who looked for us to nose cagada foi super careful com dicas da cidade for nossa family, Gosotario muito of grateful hair Carinho e Prestza.We will use common and indicate to usos friends."
Maria M,https://www.tripadvisor.com/Profile/mariamE9349UL,https://media-cdn.tripadvisor.com/media/photo-o/15/71/8a/cf/caption.jpg,,5,Feb 2019 • Solo,Segurança ,Super recomendo. Já usei outras vezes e não me arrependo . Pessoal extremamente pontual e educado para fazer o traslado do aeroporto. Obrigada Márcio e Alex pelo transporte!,0,,"Written February 7, 2019",This review is the subjective opinion of a Tripadvisor member and not of Tripadvisor LLC.,Super recommend.Já usei outras once I am regretting.Extremely pontual and educated weight for fazer or transfer of airport.Obrigada Márcio e Alex Haircrans Transport!
Luciano M,https://www.tripadvisor.com/Profile/lucianomO9323YW,https://media-cdn.tripadvisor.com/media/photo-o/1a/f6/f4/20/default-avatar-2020-31.jpg,,5,Dec 2018 • Family,Serviço Impecável,"Contratamos a empresa para serviço de receptivo no aeroporto JFK até nosso hotel na Times Square.<br />Durante a nossa estadia fizemos outros passeios como city tour diurno, noturno, compras no Woodbury Outlets e visitamos a capital Washington.<br />Veículos confortáveis, motoristas  atenciosos e muito prestativos. Parabéns equipe Braztous, Alex, Márcio, Fábio e Leandro.",0,https://media-cdn.tripadvisor.com/media/photo-m/1280/16/54/c7/0a/braztours.jpg,"Written February 2, 2019",This review is the subjective opinion of a Tripadvisor member and not of Tripadvisor LLC.,"We hire company for receptive serviço no airport jfk até nosso hotel na Times Square.Confortaveis, Motorists and Muito Baboles.Parabéns Equipe Braztous, Alex, Márcio, Fábio and Leandro."
samir m,https://www.tripadvisor.com/Profile/W8635CXsamirm,https://media-cdn.tripadvisor.com/media/photo-o/1a/f6/e2/4a/default-avatar-2020-42.jpg,,5,Dec 2018 • Friends,Viagem à Nova York,"Alex é um excelente profissional, prestativo e pontual. Um amigo que sempre utilizava seus serviços quando ia a NY me indicou e desde então sempre sou atendido por ele. Tenho indicado a amigos e todos sempre confirmam que receberam um ótimo atendimento.",0,,"Written January 30, 2019",This review is the subjective opinion of a Tripadvisor member and not of Tripadvisor LLC.,"Alex é um excellent profissional, provision and pontual.Um friend who used seus serviços when the one indicated from the semi -sou attended by ele.I have indicated to friends and all semi -configmam that receberam um otimo attends."
Liliana,https://www.tripadvisor.com/Profile/lilianav65,https://media-cdn.tripadvisor.com/media/photo-o/1a/f6/ea/74/default-avatar-2020-68.jpg,,5,Dec 2018 • Couples,Atendimento de qualidade e estilo,"Todos os serviços prestados conforme o combinado.<br />Receptivo dentro do aeroporto, veículo ótimo, motorista gentil e com muito conhecimento de Nova York,<br />Super recomendo",0,,"Written January 27, 2019",This review is the subjective opinion of a Tripadvisor member and not of Tripadvisor LLC.,"All served as provided in accordance or combined. <br /> Receptive inside airport, oto vecle, Gentile Motorist and Com Mito Conhecimento de Nova York, <br /> Super recommend"
Stela A,https://www.tripadvisor.com/Profile/162stelaa,https://media-cdn.tripadvisor.com/media/photo-o/1a/f6/f3/23/default-avatar-2020-28.jpg,,5,Jan 2019 • Family,Excelente!,"Utilizamos os serviços da Braztours em NY e foi realmente excelente. Tanto o Alex quanto o Fábio são extremamente profissionais e simpáticos, os carros muito confortáveis e limpos. Super pontuais (o que é muito importante para mim).<br />Com certeza recomendo e voltaremos a utilizar a empresa!",0,,"Written January 26, 2019",This review is the subjective opinion of a Tripadvisor member and not of Tripadvisor LLC.,"We use the Serviços Da Braztours em ny e foi really excellent.Both or Alex Quanto or Fábio São extremely profISionais and sympathetic, the cars very conforta and limpos.Super Pontuais (or what a very important one for Mim). <br /> Com certainness recommended and we will voltage to company!"
Nelson M,https://www.tripadvisor.com/Profile/nelsonmK9725XG,https://media-cdn.tripadvisor.com/media/photo-o/1a/f6/e5/2b/default-avatar-2020-52.jpg,,5,Dec 2018 • Family,Passeio em Washington,"Tour excelente, confortável, altamente profissional. Recomendo para aqueles que desejarem passar o dia vendo e aprendendo a história dos Estados Unidos.",0,,"Written January 25, 2019",This review is the subjective opinion of a Tripadvisor member and not of Tripadvisor LLC.,"Excellent Tour, Confortável, highly profissional.I recommend that you want to pass or day I sell and learn to History two United States."
Laura B,https://www.tripadvisor.com/Profile/U9431LKlaurab,https://media-cdn.tripadvisor.com/media/photo-o/1a/f6/f3/7c/default-avatar-2020-29.jpg,"Jundiai, SP",5,Jan 2019 • Couples,Excelente!!,"Contratamos os serviços de transfer aeroporto/hotel hotel/ aeroporto e tb nos levou para as compras no outlet em New Jersey. Muito prestativo, pontual e deu varias dicas sobre NYC. Carro confortável, acomodou perfeitamente as nossas bagagens. Super indicado!! Parabéns pelo trabalho!",0,,"Written January 24, 2019",This review is the subjective opinion of a Tripadvisor member and not of Tripadvisor LLC.,"We hired the Serviços of Transfer Airport/ Hotel Hotel/ Airport E TB Nos Levou for purchases not outlet em new Jersey.Muito, Pontual e deu several dicas on NYC.Confortável car, perfeitally accommodated as we nossas bagagens.Super indicated !!Parabéns Happy Hair!"
